[
  {
    "operation_latex": "+",
    "pdg_id": "0002222764",
    "local_id_in_derivation": "local-id-23e44934-a360-439b-82af-d72255b8810d",
    "equation_labels": [
      "eq_general_solution",
      "eq_eval_pos_zero",
      "eq_velocity_derivation",
      "eq_eval_vel_zero",
      "eq_specific_solution",
      "eq_trig_expansion",
      "eq_pythagorean_sum",
      "eq_pythagorean_factor",
      "euler_eq",
      "eq_amplitude_def",
      "eq_complex_magnitude",
      "eq_complex_argument"
    ],
    "description": "Binary addition of two scalar terms.",
    "explanation": "Matches the binary addition operator (+) in the database with ID 0002222764.",
    "confidence": "high"
  },
  {
    "operation_latex": "-",
    "pdg_id": "0002222427",
    "local_id_in_derivation": "local-id-de66475f-ec34-4a8c-aa97-e0468f69ea29",
    "equation_labels": [
      "eq_amplitude_phase_form",
      "cos_difference",
      "sin_squared",
      "eq_velocity_time_form",
      "eq_v_squared",
      "eq_v_squared_trig",
      "x_squared",
      "eq_v_squared_final",
      "eq_speed_pos_form",
      "eq_accel_cos"
    ],
    "description": "Binary subtraction of two scalar terms.",
    "explanation": "Matches the binary subtraction operator (-) in the database with ID 0002222427.",
    "confidence": "high"
  },
  {
    "operation_latex": "*",
    "pdg_id": "0002222829",
    "local_id_in_derivation": "local-id-54a1da4b-a5b2-4624-8556-a1ee3d35d794",
    "equation_labels": [
      "eq_newton_second_law",
      "eq_force_ma_derivative",
      "eq_hookes_law",
      "eq_force_equality",
      "eq_normalized_ode",
      "eq_ode_with_omega",
      "eq_general_solution",
      "eq_eval_pos_zero",
      "eq_velocity_derivation",
      "eq_eval_vel_zero",
      "eq_vel_c2_relation",
      "eq_specific_solution",
      "eq_amplitude_phase_form",
      "cos_difference",
      "eq_trig_expansion",
      "eq_coeff_c1",
      "eq_coeff_c2",
      "eq_pythagorean_sum",
      "eq_pythagorean_factor",
      "eq_tangent_ratio",
      "eq_complex_magnitude",
      "eq_complex_argument",
      "eq_velocity_time_form",
      "eq_v_max",
      "eq_v_squared",
      "eq_v_squared_trig",
      "x_squared",
      "eq_v_squared_final",
      "eq_speed_pos_form",
      "eq_accel_cos",
      "eq_acceleration_pos_form",
      "eq_a_max",
      "eq_omega_frequency_relation",
      "eq_freq_derivation_step",
      "eq_frequency_formula",
      "eq_period_formula"
    ],
    "description": "Binary multiplication of two scalar terms (implicit juxtaposition / multiplication).",
    "explanation": "Matches multiplication in the database with ID 0002222829 (which defines implicit two-term juxtaposition \\multiplication[2]{ #1 #2 }).",
    "confidence": "high"
  },
  {
    "operation_latex": "\\frac{}{}",
    "pdg_id": "0002222891",
    "local_id_in_derivation": "local-id-f0b52d61-3b41-4ebd-a2a6-cdc0dafefa2c",
    "equation_labels": [
      "eq_normalized_ode",
      "eq_omega_squared_def",
      "eq_omega_definition",
      "eq_c2_is_v0_omega",
      "eq_specific_solution",
      "eq_tangent_ratio",
      "eq_phase_def",
      "eq_frequency_formula",
      "eq_period_def",
      "eq_period_formula",
      "eq_freq_derivation_step"
    ],
    "description": "Fractional division between numerator and denominator.",
    "explanation": "Matches the division operator in the database with ID 0002222891 (which defines fraction format \\frac{#1}{#2}).",
    "confidence": "high"
  },
  {
    "operation_latex": "\\sqrt{}",
    "pdg_id": "0007843744",
    "local_id_in_derivation": "local-id-8e8ca3a9-b3f9-438f-8094-8a6ca842a6f3",
    "equation_labels": [
      "eq_omega_definition",
      "eq_specific_solution",
      "eq_amplitude_def",
      "eq_speed_pos_form",
      "eq_freq_derivation_step",
      "eq_frequency_formula",
      "eq_period_formula"
    ],
    "description": "Unary square root operation.",
    "explanation": "Matches the square root operation (\\sqrt{}) in the database with ID 0007843744.",
    "confidence": "high"
  },
  {
    "operation_latex": "\\cos",
    "pdg_id": "0002222940",
    "local_id_in_derivation": "local-id-1006d281-ae62-4496-aa48-f8845c5fd98e",
    "equation_labels": [
      "eq_general_solution",
      "eq_eval_pos_zero",
      "cos_zero",
      "eq_velocity_derivation",
      "eq_eval_vel_zero",
      "eq_specific_solution",
      "eq_amplitude_phase_form",
      "cos_difference",
      "eq_trig_expansion",
      "eq_coeff_c1",
      "eq_pythagorean_sum",
      "eq_pythagorean_factor",
      "euler_eq",
      "eq_tangent_ratio",
      "sin_squared",
      "eq_v_squared_trig",
      "x_squared",
      "eq_accel_cos"
    ],
    "description": "Trigonometric cosine function.",
    "explanation": "Matches the cosine function (\\cos) in the database with ID 0002222940.",
    "confidence": "high"
  },
  {
    "operation_latex": "\\sin",
    "pdg_id": "0002222144",
    "local_id_in_derivation": "local-id-04cd3e06-06bf-4121-85c8-656451861c97",
    "equation_labels": [
      "eq_general_solution",
      "eq_eval_pos_zero",
      "sin_zero",
      "eq_velocity_derivation",
      "eq_eval_vel_zero",
      "eq_specific_solution",
      "cos_difference",
      "eq_trig_expansion",
      "eq_coeff_c2",
      "eq_pythagorean_sum",
      "eq_pythagorean_factor",
      "euler_eq",
      "eq_tangent_ratio",
      "eq_velocity_time_form",
      "sin_squared",
      "eq_v_squared"
    ],
    "description": "Trigonometric sine function.",
    "explanation": "Matches the sine function (\\sin) in the database with ID 0002222144.",
    "confidence": "high"
  },
  {
    "operation_latex": "\\tan",
    "pdg_id": "0002532789",
    "local_id_in_derivation": "local-id-7152a8a2-3e72-4ac6-b766-cbced09e9bdf",
    "equation_labels": [
      "eq_phase_def"
    ],
    "description": "Trigonometric tangent function.",
    "explanation": "Matches the tangent function (\\tan) in the database with ID 0002532789.",
    "confidence": "high"
  },
  {
    "operation_latex": "\\text{arg}",
    "pdg_id": "2288488773",
    "local_id_in_derivation": "local-id-67226601-55e8-46b2-9225-5eb6a25f61ae",
    "equation_labels": [
      "eq_complex_argument"
    ],
    "description": "Complex argument / phase angle operation.",
    "explanation": "Matches the complex argument function (\\arg) in the database with ID 2288488773.",
    "confidence": "high"
  }
]